{
	"$schema": "https://schema.streamr.network/config-v2.schema.json",
	"streamrClient": {
		"auth": {
			"privateKey": "0xbb00000000000000000000000000000000000000000000000000000000000001"
		}
	},
	"mode": {
		"type": "standalone",
		"trackedStreams": [
			{
				"id": "0xd37dc4d7e2c1bdf3edd89db0e505394ea69af43d/gas-station/ethereum",
				"partitions": 1
			}
		]
	},
	"httpServer": {
		"port": 7774
	},
	"plugins": {
		"logStore": {
			"db": {
				"type": "sqlite",
				"dataPath": ".logstore/data/logstore-node.db"
			},
			"programs": {
				"chainRpcUrls": {
					"137": "https://polygon.llamarpc.com"
				}
			}
		}
	}
}
