{
	"$schema": "https://schema.streamr.network/config-v2.schema.json",
	"logStoreClient": {
		"contracts": {
			"logStoreNodeManagerChainAddress": "0x85ac4C8E780eae81Dd538053D596E382495f7Db9",
			"logStoreStoreManagerChainAddress": "0x8560200b8E7477FB09281A0566B50fa6E7a66a34",
			"logStoreQueryManagerChainAddress": "0x65d379f29BE436bD367699f3Dd7A436c54795a49",
			"logStoreTheGraphUrl": "http://127.0.0.1:8000/subgraphs/name/logstore-dev/network-contracts"
		}
	},
	"streamrClient": {
		"logLevel": "trace",
		"auth": {
			"privateKey": "0xbb00000000000000000000000000000000000000000000000000000000000004"
		},
		"network": {
			"id": "0x392Bd2cb87f5670F321Ad521397d30a00c582b34",
			"trackers": [
				{
					"id": "0xb9e7cEBF7b03AE26458E32a059488386b05798e8",
					"ws": "ws://127.0.0.1:30301",
					"http": "http://127.0.0.1:30301"
				},
				{
					"id": "0x0540A3e144cdD81F402e7772C76a5808B71d2d30",
					"ws": "ws://127.0.0.1:30302",
					"http": "http://127.0.0.1:30302"
				},
				{
					"id": "0xf2C195bE194a2C91e93Eacb1d6d55a00552a85E2",
					"ws": "ws://127.0.0.1:30303",
					"http": "http://127.0.0.1:30303"
				}
			],
			"location": {
				"latitude": 60.19,
				"longitude": 24.95,
				"country": "Finland",
				"city": "Helsinki"
			},
			"webrtcDisallowPrivateAddresses": false
		},
		"contracts": {
			"streamRegistryChainAddress": "0x6cCdd5d866ea766f6DF5965aA98DeCCD629ff222",
			"streamStorageRegistryChainAddress": "0xd04af489677001444280366Dd0885B03dAaDe71D",
			"storageNodeRegistryChainAddress": "0x231b810D98702782963472e1D60a25496999E75D",
			"streamRegistryChainRPCs": {
				"chainId": 8997,
				"rpcs": [
					{
						"url": "http://127.0.0.1:8546"
					}
				]
			},
			"mainChainRPCs": {
				"chainId": 8995,
				"rpcs": [
					{
						"url": "http://127.0.0.1:8545"
					}
				]
			},
			"theGraphUrl": "http://127.0.0.1:8000/subgraphs/name/streamr-dev/network-contracts"
		},
		"metrics": false
	},
	"mode": {
		"type": "standalone",
		"trackedStreams": [
			{
				"id": "0x392bd2cb87f5670f321ad521397d30a00c582b34/mpctlsproofspublic",
				"partitions": 1
			}
		]
	},
	"httpServer": {
		"port": 7774
	},
	"plugins": {
		"logStore": {
			"db": {
				"type": "sqlite"
			},
			"logStoreConfig": {
				"refreshInterval": 10000
			},
			"programs": {
				"chainRpcUrls": {
					"8997": "http://127.0.0.1:8546"
				}
			}
		}
	}
}